{
  "schemaVersion": 1,
  "runId": "00000000-0000-5000-8000-000000000001",
  "servingModelId": "00000000-0000-5000-8000-000000000002",
  "servingModelVersion": 0,
  "embeddingSpaceId": "00000000-0000-5000-8000-000000000003",
  "pgvectorSnapshotSha256": "bfa0394b9687b75def7ce9bdcc85357e6ba36913856709bb7286768c104c6f6b",
  "orderedBabelIds": [
    "00000000-0000-5000-8000-000000000201",
    "00000000-0000-5000-8000-000000000202",
    "00000000-0000-5000-8000-000000000203",
    "00000000-0000-5000-8000-000000000204",
    "00000000-0000-5000-8000-000000000205",
    "00000000-0000-5000-8000-000000000206"
  ],
  "rowCount": 6,
  "vectorSha256": "f19a97c469a80930d092ef8daf6d08c135254df2433ae9a79452616304608a6d",
  "m": 16,
  "efConstruction": 200,
  "efSearch": 100
}
